{
  "version": 1,
  "contract_version": 1,
  "wheel_version": "0.3.2",
  "fixture": "npz-real:focus-50v-real.npz",
  "input_frame_count": 13,
  "pixel_to_micron": 0.4886,
  "source": "mib-processing-wheel-conformance",
  "frames": [
    {
      "frame_type": "valid",
      "index": 0,
      "timestamp_ns": 0,
      "object_id": 1,
      "object_count": 4,
      "track_id": 1,
      "track_first_frame": 0,
      "track_last_frame": 0,
      "track_observation_count": 1,
      "deformability": 0.0630888904436292,
      "area": 24.5,
      "area_um2": 5.848884019999999,
      "area_ratio": 1.0,
      "ring_ratio": 14.2828568570857,
      "youngs_modulus": 0.0,
      "is_valid": true,
      "touches_border": false,
      "has_single_inner_contour": false,
      "in_range": true,
      "is_target_group": false,
      "inner_contour_count": 4,
      "brightness_q1": 106.0,
      "brightness_q2": 113.0,
      "brightness_q3": 122.0,
      "brightness_q4": 144.0,
      "mask_sha256": "7d564362a62b1c88f930793bc9b3a7b2c2417037df8bfa9e400103439932d0bf",
      "series_images_sha256": []
    },
    {
      "frame_type": "valid",
      "index": 0,
      "timestamp_ns": 0,
      "object_id": 2,
      "object_count": 4,
      "track_id": 2,
      "track_first_frame": 0,
      "track_last_frame": 0,
      "track_observation_count": 1,
      "deformability": 0.0740563601905555,
      "area": 16.0,
      "area_um2": 3.81967936,
      "area_ratio": 1.1428571428571428,
      "ring_ratio": 24.06241883103193,
      "youngs_modulus": 0.0,
      "is_valid": true,
      "touches_border": false,
      "has_single_inner_contour": false,
      "in_range": true,
      "is_target_group": false,
      "inner_contour_count": 4,
      "brightness_q1": 116.0,
      "brightness_q2": 120.0,
      "brightness_q3": 125.0,
      "brightness_q4": 146.0,
      "mask_sha256": "7d564362a62b1c88f930793bc9b3a7b2c2417037df8bfa9e400103439932d0bf",
      "series_images_sha256": []
    },
    {
      "frame_type": "valid",
      "index": 0,
      "timestamp_ns": 0,
      "object_id": 3,
      "object_count": 4,
      "track_id": 3,
      "track_first_frame": 0,
      "track_last_frame": 1,
      "track_observation_count": 2,
      "deformability": 0.07764837461437513,
      "area": 12.0,
      "area_um2": 2.86475952,
      "area_ratio": 1.0,
      "ring_ratio": 44.91658936295141,
      "youngs_modulus": 0.0,
      "is_valid": true,
      "touches_border": false,
      "has_single_inner_contour": false,
      "in_range": true,
      "is_target_group": false,
      "inner_contour_count": 4,
      "brightness_q1": 115.0,
      "brightness_q2": 122.0,
      "brightness_q3": 131.0,
      "brightness_q4": 195.0,
      "mask_sha256": "7d564362a62b1c88f930793bc9b3a7b2c2417037df8bfa9e400103439932d0bf",
      "series_images_sha256": []
    },
    {
      "frame_type": "valid",
      "index": 0,
      "timestamp_ns": 0,
      "object_id": 4,
      "object_count": 4,
      "track_id": 4,
      "track_first_frame": 0,
      "track_last_frame": 1,
      "track_observation_count": 2,
      "deformability": 0.07764837461437513,
      "area": 12.0,
      "area_um2": 2.86475952,
      "area_ratio": 1.0,
      "ring_ratio": 44.91658936295141,
      "youngs_modulus": 0.0,
      "is_valid": true,
      "touches_border": false,
      "has_single_inner_contour": false,
      "in_range": true,
      "is_target_group": false,
      "inner_contour_count": 4,
      "brightness_q1": 115.0,
      "brightness_q2": 122.0,
      "brightness_q3": 131.0,
      "brightness_q4": 195.0,
      "mask_sha256": "7d564362a62b1c88f930793bc9b3a7b2c2417037df8bfa9e400103439932d0bf",
      "series_images_sha256": []
    },
    {
      "frame_type": "valid",
      "index": 1,
      "timestamp_ns": 0,
      "object_id": 3,
      "object_count": 3,
      "track_id": 5,
      "track_first_frame": 1,
      "track_last_frame": 1,
      "track_observation_count": 1,
      "deformability": 0.07764837461437513,
      "area": 12.0,
      "area_um2": 2.86475952,
      "area_ratio": 1.0,
      "ring_ratio": 32.64965543462902,
      "youngs_modulus": 0.0,
      "is_valid": true,
      "touches_border": false,
      "has_single_inner_contour": false,
      "in_range": true,
      "is_target_group": false,
      "inner_contour_count": 3,
      "brightness_q1": 119.0,
      "brightness_q2": 128.0,
      "brightness_q3": 138.0,
      "brightness_q4": 190.0,
      "mask_sha256": "4d713d083d94cbcd9fa4a33554f250ee45b4b9bdf17ed61ded386dcff69ccc7f",
      "series_images_sha256": []
    },
    {
      "frame_type": "invalid",
      "index": 2,
      "timestamp_ns": 0,
      "object_id": -1,
      "object_count": 0,
      "track_id": -1,
      "track_first_frame": 0,
      "track_last_frame": 0,
      "track_observation_count": 0,
      "deformability": 0.0,
      "area": 0.0,
      "area_um2": 0.0,
      "area_ratio": 0.0,
      "ring_ratio": 0.0,
      "youngs_modulus": 0.0,
      "is_valid": false,
      "touches_border": false,
      "has_single_inner_contour": false,
      "in_range": false,
      "is_target_group": false,
      "inner_contour_count": 0,
      "brightness_q1": 57.0,
      "brightness_q2": 91.0,
      "brightness_q3": 115.0,
      "brightness_q4": 255.0,
      "mask_sha256": "f090e0a01c0f7d04fe838a70df89712d29ecaff9a438e5d3d9e55026c44627c8",
      "series_images_sha256": []
    },
    {
      "frame_type": "valid",
      "index": 3,
      "timestamp_ns": 0,
      "object_id": 1,
      "object_count": 1,
      "track_id": 1,
      "track_first_frame": 0,
      "track_last_frame": 0,
      "track_observation_count": 1,
      "deformability": 0.07764837461437513,
      "area": 12.0,
      "area_um2": 2.86475952,
      "area_ratio": 1.0,
      "ring_ratio": 49.84475900232641,
      "youngs_modulus": 0.0,
      "is_valid": true,
      "touches_border": false,
      "has_single_inner_contour": true,
      "in_range": true,
      "is_target_group": false,
      "inner_contour_count": 1,
      "brightness_q1": 63.0,
      "brightness_q2": 106.0,
      "brightness_q3": 159.0,
      "brightness_q4": 218.0,
      "mask_sha256": "f5e6fcb1c9edc600dc826d021e0a20e016253ce30172b0404579c3bbc6ab403d",
      "series_images_sha256": []
    },
    {
      "frame_type": "valid",
      "index": 4,
      "timestamp_ns": 0,
      "object_id": 1,
      "object_count": 1,
      "track_id": 2,
      "track_first_frame": 1,
      "track_last_frame": 1,
      "track_observation_count": 1,
      "deformability": 0.07764837461437513,
      "area": 12.0,
      "area_um2": 2.86475952,
      "area_ratio": 1.0,
      "ring_ratio": 52.478567053607705,
      "youngs_modulus": 0.0,
      "is_valid": true,
      "touches_border": false,
      "has_single_inner_contour": true,
      "in_range": true,
      "is_target_group": false,
      "inner_contour_count": 1,
      "brightness_q1": 62.0,
      "brightness_q2": 109.0,
      "brightness_q3": 161.0,
      "brightness_q4": 219.0,
      "mask_sha256": "9a725fe858aca636a51927c25a9e0b069dae3cd74dedea20c352993583e7ae31",
      "series_images_sha256": []
    },
    {
      "frame_type": "invalid",
      "index": 5,
      "timestamp_ns": 0,
      "object_id": 1,
      "object_count": 1,
      "track_id": -1,
      "track_first_frame": 0,
      "track_last_frame": 0,
      "track_observation_count": 0,
      "deformability": 0.0,
      "area": 0.0,
      "area_um2": 0.0,
      "area_ratio": 0.0,
      "ring_ratio": 0.0,
      "youngs_modulus": 0.0,
      "is_valid": false,
      "touches_border": true,
      "has_single_inner_contour": true,
      "in_range": false,
      "is_target_group": false,
      "inner_contour_count": 1,
      "brightness_q1": 95.0,
      "brightness_q2": 131.0,
      "brightness_q3": 151.0,
      "brightness_q4": 193.0,
      "mask_sha256": "436bfa9bdbfd52e5bdf3e12c3dab3c96396b1e1cf44bb79335eeca7b740faa98",
      "series_images_sha256": []
    },
    {
      "frame_type": "invalid",
      "index": 6,
      "timestamp_ns": 0,
      "object_id": -1,
      "object_count": 0,
      "track_id": -1,
      "track_first_frame": 0,
      "track_last_frame": 0,
      "track_observation_count": 0,
      "deformability": 0.0,
      "area": 0.0,
      "area_um2": 0.0,
      "area_ratio": 0.0,
      "ring_ratio": 0.0,
      "youngs_modulus": 0.0,
      "is_valid": false,
      "touches_border": false,
      "has_single_inner_contour": false,
      "in_range": false,
      "is_target_group": false,
      "inner_contour_count": 0,
      "brightness_q1": 62.0,
      "brightness_q2": 114.0,
      "brightness_q3": 159.0,
      "brightness_q4": 255.0,
      "mask_sha256": "7a157e643738eb63556351d9836ba49b856cf4de559ff0e2ef735119ab8f6eba",
      "series_images_sha256": []
    },
    {
      "frame_type": "valid",
      "index": 7,
      "timestamp_ns": 0,
      "object_id": 1,
      "object_count": 5,
      "track_id": 1,
      "track_first_frame": 0,
      "track_last_frame": 1,
      "track_observation_count": 2,
      "deformability": 0.11438514594603766,
      "area": 53.5,
      "area_um2": 12.772052859999999,
      "area_ratio": 1.07,
      "ring_ratio": 27.748873851023216,
      "youngs_modulus": 0.0,
      "is_valid": true,
      "touches_border": false,
      "has_single_inner_contour": false,
      "in_range": true,
      "is_target_group": false,
      "inner_contour_count": 5,
      "brightness_q1": 125.0,
      "brightness_q2": 131.0,
      "brightness_q3": 144.0,
      "brightness_q4": 183.0,
      "mask_sha256": "2e9f75a91a3ae0867f63021dfb2dda7a0eeb0d9525055704b6a32857baba68ba",
      "series_images_sha256": []
    },
    {
      "frame_type": "valid",
      "index": 7,
      "timestamp_ns": 0,
      "object_id": 2,
      "object_count": 5,
      "track_id": 2,
      "track_first_frame": 0,
      "track_last_frame": 1,
      "track_observation_count": 2,
      "deformability": 0.07654059696176418,
      "area": 30.5,
      "area_um2": 7.281263779999999,